{
  "$schema": "http://json-schema.org/draft-07/schema#",
  "type": "object",
  "additionalProperties": false,
  "properties": {
    "schema_version": { "type": "integer", "const": 1 },
    "id": { "type": "string", "pattern": "^[a-z0-9]+(?:-[a-z0-9]+)*$" },
    "name": { "type": "string", "minLength": 1 },
    "url": { "type": "string", "pattern": "^https?://\\S+$" },
    "description": { "type": "string" },
    "notes": {
      "type": "object",
      "additionalProperties": false,
      "properties": {
        "top": { "type": "array", "items": { "type": "string" } },
        "heart": { "type": "array", "items": { "type": "string" } },
        "base": { "type": "array", "items": { "type": "string" } }
      },
      "required": ["top", "heart", "base"]
    },
    "gender": { "type": "string", "enum": ["male", "female", "unknown"] }
  },
  "required": ["schema_version", "id", "name", "url", "description", "notes", "gender"]
}
