{
  "schema_version": 1,
  "id": "special-vainille-tff",
  "name": "Special Vainille (TFF)",
  "url": "https://perfumarte.com/products/special-vainille-tff",
  "description": "Special Vainille (TFF): un perfume nicho unisex, oriental y profundamente avainillado\n\nSpecial Vainille (TFF) es un perfume nicho unisex creado para quienes disfrutan de las fragancias cálidas, sofisticadas y con una personalidad inconfundible. Inspirado en la fuerza de la naturaleza, combina acordes orientales con una vainilla intensa y envolvente que convierte cada aplicación en una experiencia elegante y adictiva.\n\nEste perfume nicho unisex destaca por su equilibrio entre intensidad y suavidad, siendo una opción versátil para cualquier momento del día y para todas las estaciones del año.\n\n \n\n \n\n¿A qué huele Special Vainille (TFF)?\n\nSpecial Vainille (TFF) es un perfume nicho unisex donde la vainilla y los acordes orientales se fusionan para crear una fragancia cálida, sensual y muy elegante.\n\nUna salida cálida y envolvente\n\nLa fragancia se abre con acordes orientales que aportan profundidad, misterio y una sensación de lujo desde el primer instante.\n\nUn corazón cremoso y avainillado\n\nEn el desarrollo, la vainilla adquiere todo el protagonismo, ofreciendo una textura cremosa, suave y ligeramente dulce que envuelve la piel con gran elegancia.\n\nUn fondo intenso, sofisticado y duradero\n\nEl secado mantiene la riqueza de la vainilla junto a los matices orientales, dejando una estela cálida, refinada y muy persistente que acompaña durante horas.",
  "notes": {
    "top": [
      "azafran",
      "cilantro",
      "mirra"
    ],
    "heart": [
      "cafe",
      "incienso",
      "naranja",
      "narciso",
      "rosa"
    ],
    "base": [
      "caoba",
      "madera de roble",
      "pachuli",
      "tabaco"
    ]
  },
  "gender": "unknown"
}