{
  "schema_version": 1,
  "id": "bianche-princess-gtb",
  "name": "Bianche Princess (GTB)",
  "url": "https://perfumarte.com/products/bianche-princess-gtb",
  "description": "Bianche Princess (GTB): un perfume nicho gourmand femenino, dulce y sofisticado\n\nBianche Princess (GTB) es un perfume nicho gourmand femenino que celebra la dulzura, la calidez y la elegancia en una fragancia envolvente y adictiva. Diseñado para mujeres que disfrutan de aromas golosos pero refinados, combina notas dulces con un fondo suave y elegante que lo hace perfecto para el día a día o momentos especiales.\n\nEste perfume nicho gourmand femenino destaca por su carácter cálido, cremoso y muy femenino, dejando una estela inolvidable.\n\n \n\n \n\n¿A qué huele Bianche Princess (GTB)?\n\nBianche Princess (GTB) es un perfume nicho gourmand femenino donde el caramelo, la miel, la cumarina, la vainilla y el almizcle blanco crean una fragancia dulce, cálida y sofisticada.\n\nUna salida dulce y golosa\n\nLa fragancia se abre con caramelo, ofreciendo un inicio adictivo, alegre y envolvente que conquista desde el primer instante.\n\nUn corazón cálido y elegante\n\nLa cumarina y la miel aportan una faceta suave, dulce y sofisticada que equilibra perfectamente el carácter gourmand.\n\nUn fondo cremoso y duradero\n\nLa vainilla y el almizcle blanco crean una base envolvente, delicada y muy femenina que deja una estela suave, elegante y persistente.",
  "notes": {
    "top": [
      "Caramelo"
    ],
    "heart": [
      "Cumarina",
      "Miel"
    ],
    "base": [
      "Almizcle blanco",
      "Vainilla"
    ]
  },
  "gender": "female"
}