{
  "schema_version": 1,
  "id": "golden-warrior-pma",
  "name": "Golden Warrior (PMA)",
  "url": "https://perfumarte.com/products/golden-warrior-pma",
  "description": "Golden Warrior (PMA): un perfume nicho gourmand especiado, intenso y adictivo\n\nGolden Warrior (PMA) es un perfume nicho gourmand especiado creado para quienes buscan una fragancia potente, cálida y con una personalidad muy marcada. Su combinación de especias vibrantes, dulzura cremosa y maderas oscuras da como resultado un aroma envolvente y altamente adictivo.\n\nEste perfume nicho gourmand especiado destaca por su intensidad y su carácter seductor, perfecto para dejar huella en cualquier ocasión especial.\n\n \n\n \n\n¿A qué huele Golden Warrior (PMA)?\n\nGolden Warrior (PMA) es un perfume nicho gourmand especiado donde la canela, el cardamomo, la vainilla Bourbon, el praliné, la haba tonka y las maderas oscuras crean una fragancia cálida, dulce y profundamente sofisticada.\n\nUna salida especiada y vibrante\n\nLa fragancia se abre con canela y cardamomo, aportando un inicio cálido, energético y ligeramente picante que despierta los sentidos.\n\nUn corazón cremoso y envolvente\n\nLa vainilla Bourbon aporta suavidad, dulzura y una sensación gourmand elegante que equilibra perfectamente las especias iniciales.\n\nUn fondo dulce, oscuro y adictivo\n\nEl praliné, la haba tonka y las maderas oscuras crean una base intensa, cálida y muy seductora que deja una estela profunda y duradera.",
  "notes": {
    "top": [
      "bergamota - canela- cardamomo - flor de azahar -"
    ],
    "heart": [
      "balsamo de tolu - elemí - vainilla bourbon - almendras acarameladas - almizcle -"
    ],
    "base": [
      "ambroxan - haba tonka - madera de gaiac - praliné"
    ]
  },
  "gender": "unknown"
}